id,versek510,honnan madár jő tavasz kezdetével madár hűvös ködös ősszel tengerparton szent sír zöld tenger sárga partján vadbokor sötét fátyolként árnyékot boritván vadbokron kívül gyászolja senki dicső halottat zajos élet lejártával század óta hallgat végső honában szabadságért hősi kardot ránta híve sors hazája hű iránta számüzé gyáva nemzetét lássa látná megátkozná messzeségből néma fájdalommal néz nézte hős szülőföldéről ballagó felhőket melyeken estfény (vagy honának szégyenpírja égett űlt parton hallgatá csendes tenger mormogását gondolá hallja fölriadt népének távoli zugását várta várta várta jön hír szabad hazája várt várt halál jött hír hozzája otthon nevét ismerik emlékszik rája egyedűl költő szabadság örök lámpája 
520,lágyan suttogó szelíd szellő zöldelő mezőkön alá sétálok csókot lehelek bimbók ajakára édes meleg csókom hű szerelmi zálog nyíljatok nyíljatok tavasz leányi sugom fülökbe nyíljatok nyíljatok szemérmesen levetik leplöket keblökön kéjtől elájulok holnap süvöltő hang vad fuvalom reszket bokor fél tőlem látja kezemben kés köszörült kés tudja lombjait azzal lemetélem virágoknak sziszegem fülébe balga könnyenhivő lyányok hervadjatok hervadtan hullnak ősz kebelére rajtok hidegen gúnyosan kacagok lágy szellő csendes folyó úszom léget néma nyúgalomban létezésemet méhe tudja hazafelé tart rétről fáradtan fáradtan száll méh tehertől oldalán visz melyből mézet készít tenyeremre veszem kicsiny bogarat segítem lankadt röpülésit holnap vihar zúgó bőgő vihar szilaj paripámon tengert bejárom tanító csintalan gyermeknek sötétzöld üstökét haragosan rázom bejárom tengert hajót találok szárnyát lobogó vitorlát kitépem árbocával írom habokba sorsát pihenni kikötőben 
534,mezőre ballagok fű virág terem virágok virágaim kedvesek látom lyányt látnék szivem reszket keblem dagad siromra meghalok ültessetek virágokat leűlök virág elbeszélgetek vele szerelmet vallok neki megkérdem szeret szól hiszem ért érti szavaimat siromra meghalok ültessetek virágokat tudja illat virág beszéde értjük testünkön lelkünk fülibe szagolja hallja test szellemhangokat siromra meghalok ültessetek virágokat igen illat virág beszéde dala lényem durvább része sírban rólam lefejledez szagolom hallom dalokat siromra meghalok ültessetek virágokat virágillat virág dala lész bölcsődalom lágy zengedelminél tavaszonként elaluszom következendő tavaszig lelkem álmakkal mulat siromra meghalok ültessetek virágokat 
556,lennék folyóvíz hegyi folyam árja darabos utját sziklák járja szeretőm halacska habjaimban úszna vígan lubickolva lennék vad erdő folyó oldalán fergetegekkel harcot kiállanám szeretőm madárka ütne fészket ágamon dalolna lennék váromladék hegy legtetején bús pusztulásomat venném könnyedén szeretőm repkény elnyuló zöld karjaival homlokomra folyna lennék kicsiny kunyhó rejtett völgybe' eső vágta sebbel szalmafödelemen szeretőm tűz tűzhelyemen lassacskán nyájasan lobogna lennék felhődarab összetépett zászló vadontáj fáradtan megálló szeretőm alkonyat búshalovány arcom pirosan ragyogna 
570,nap hervadt rózsa lankadtan bocsátja fejét levelei halvány sugárok bús mosollyal hullnak néma csendes világ körűlem szól estharang szépen égbül jönne édes álomból hang hallgatom mély figyelemmel ábrándos hang jólesik tudj' isten érzek érzek tudja isten eszem 
581,megtépve megcsufolva sivatag közepén magában zászló szolgálok hosszú vihar ennyit tépe bármint rontva látszik csonka szárnyán isten képe szent jelnek gyérülnek hívei bálvány elébe térdet főt hajtani menjenek méltók sorban állni vélünk fecskék ledérek éghajlatot cserélnek sasok cserélünk varázshatalmú diszetlen csonka jel legdicsőbbek érte alatta haltak mutatja mutatja igazság isten oltáránál világ odább megállok siriglan 
593,vannak hellenek celták eltűntenek város tengerek árja benyel tornyaik orma maradt vízből torony orma homér oszián koldús vala királyfi emez különbség egybe' hasonlatosak mindketteje vak szemfényeiket lelkök lobogó tüze önnön dicsőségök ragyogása vevé szellemek varázskezeik érintik lant idegét isten igéje világot alkotnak ember elé bámulatos bámulatos halljátok homért dalában mennyei bolt csendes örömnek örök mosolya hajnali bíbor déli sugár aranya nyájasan ömlik alá tengeri szőke habokra bennök zöld szigetekre istenek űzik emberi nemmel boldog vegyülésben játékidat gyönyörű szerelem látjátok osziánt éjszaki tenger örök ködü földén vad szikla viharokkal harsogja dalát alaktalan éjben feljön hold lemenő nap vérvörösen zord fénybe borítja rengeteget bolygnak seregestül harc mezején elesett daliák bús szellemei világos virágzó dalodban koldusok őse homér sötét sivár dalodba' királyi utód oszián daloljatok verjétek lantot isteni lantot homér oszián eljőnek évek századjai ezredei letipornak könyörtelenül szentek előttök mindenre sárga halált lehelik ősz fejetek koszorúja zöld 
599,fekszem hanyatt föld sötétzöld szőnyegén merengve nézem sötétkék eget száll aranyos ezüstös csillagfény koszorú övezi fejemet megfürösztém lelkem sugárözönben lemosott magáról földi szennyet ujjászületve magasba röppen keresi mennyet alszik föld mély csendes álma halk dongás érinti fülemet mellém valami bogárka szálla távoli folyam harsogása távoliabb felhők mennydörgése ér parányivá törpül lelkemnek himnusz éneklése csillagkörbül szállj lelkem szállj égitestek pillants keresztül rejtelmök fátyolán istenség titkos ujja szövött bölcsességből szeszélyből nézd lelkem csillagokon nézd vagyon csillagok röpűlj gyors szárnyadon beszéljek kérdjem láttál élet gyötrelmes bús földi kemény szigorú itélet jutalmat oszt boszúját tölti közöm ehhez egyet szeretnék egyet megtudni hozz hírt vannak szívek szívek mélyén lángol szerelem szeretnek ah vágyok feljussak forrón imádkozni fogok szerelem kísér isten hozzátok ragyogó csillagok szebb föld búbánata enyésszem sírba fognak tenni szerelem pótol szerelmet pótolja 
608,ül kevélyebben huszár lovon kisbéres vendégoldalon behordta szénát gazda padlására üres szekerével ballag tanyára címeres ökör sétál szekérrel legelöl hajszás csengetyűjével ritka csengetyű hangos szava harangnak illenék holmi faluba kiált kisbéres cselő csákó cselő szekérből ostort veszi kétöles nyele három kötele irgalmatlanul elkezd pattogni vele kati gyomlál kertben serényen szekér házok mégyen pillantott ráismére ostora hangjáról béreslegényre megörűlt örömébe' paréjt virágot tépe tépve csináljon vele nyujtja sövényen kisbéres fele kisbéres koránsem ajándékot szokta elfogadni kivált neki leány kinálja legkivált leány babája elfogadta tüzte kalapjára fölugrott szekér oldalára közéje vágott tinajának kevélyebben tartott tanyának fejében gondolt érezett szivében mondhata hirtelenében utjában szépen elfütyölte pacsírták tanulhattak tőle 
630,hold isten vétettem legnyomorúbb lénnyé tettél föld utósó szolgája égen éj ragyogó királya járnék koldús bocskorában járok ezüstsarkantyús csizmában színám csapszékek borszagát csillagvirágok illatát lélek szánná sorsomat kutya poéta megugat ezek tollrágó versgyártó pimaszok kiknek szíve füle mozog hiszik velök követ fújok rokonérzelemből velök busúlok sápadt fájdalomtul méregtől torkomon dul komáznak énvelem fickók vernénk csürhére disznót jön igazijából kipattant szikra isten homlokából valódi költő dala hallatára keblemet megtölti gyönyörnek árja jön dalnok keserves nyávogást hallok efféle mákvirág bokorban nő ezekre sovány esztendő este félve kezdem útazásom akad fülem nyikorgáson ni terpeszkedik meghányja veti parasztlőcs kezeit akarná hajítani markába szorítani megsohajtoz kárvallott cigány erek csakugy dagadnak nyakán össze beszél váltig kérdez kér tekintsek szeretőjéhez betekintek öcsém jutka épen buvik kemencelyukba sűlt kolompért szed pofázza befelé megégette száját hirtelen nyelé gyönyörűen rántja arcát bájos orca épen méltó megmondtam aminek tudása gyötrött menj pokolba vigyen ördög 
631,vadállat halálát sejti vén koldús puszták közepébe bujdosott élte maradékát puszták közepén tevé holttestéhez szegénylegények elvetődtek néki gödröt ástak felköték botjára tarisznyáját tüzék botot fejfának fa bokor nélkűli rónán domb egyszerű jelével természet elhagyottak gyáma vadvirágok fűvekkel födéd sors életében szennyes rongyok lengedeztek sírját napkeletnek szőnyegénél szebb szőnyeg takarja őrá nézve fő elérte nyugodalmát gondolná zajos vészes pálya ő futott kéz vénségében száraz görcsös ágat fogta ifjusága teljes erejében harcok fényes kardját villogtatta forgott ő csaták tüzében adá véréből áldozatját uraknak birtoka jogáért később éhenhalni hagyták elhalt feledve nyomorúság harci lárma csendes néma világ körűle zavaratlan földalatti álma száll madárka fejfájára ábrándos dalt zeng dalolhat madárka fejfán fejfán koldúsbot 
647,feküdjetek emberek jártok halkan lépjetek lábujjhegyen lassan járjatok durva zajt üssön ajkatok tisztelni gyászt szent éj gyászos ifjú megjelent kedvese meghala gyászol szegény éjszaka csendesen földre leborúl hull fűre könnye szomorún búsan mosolyog sírjából hold feljöve holt kedvese halvány szelleme találkoznak édes keservvel ölelkeznek kínos gyönyörrel beszélnek tudja senki sejt gyanit tudnotok beszéd örök titok őrült hallja amidőn lázas rémes óra jön haldokló pókhálószál tartja életét hallja harmadik költő ébren álmodik merengő költő érti szellem hangok rejtelmét szólhat kérdezd elfelejti fölébred 
650,lenézik szegény költőket elbizott kevély urak megyék ország gyülésén fényes szerepet játszanak pusztulj útból fiú kopottan ballagsz gyalog eltiportat úr hintón melletted elrobog vannak nagyra paripák viszik költő tengődik éhen ő szolgájok hizik szebb gondolják fontosabbak emberiség mérlegén haszontalan verselők fölfuvalkodátok tudjátok mik apró napi események mulandó pásztortüzei éjenként lát vándor föllobogtok magasan reggel tüzeknek hideg holt hamva hozzátok képest égtek költők kicsiny csillagok csillámló szikráknál százszor nagyobbak lángitok hamvatokat szellők elvivék távolságban csillag akkoron ég tanuljátok költő bánjatok szépen vele tanuljátok költő istenség szent levele leküld magas kegyében hozzátok gyarló emberek amelybe örök igazságit saját kezével írta habár nemzet venné költőket magyarok költőitek tinektek illő fejet hajtsatok magyar költőknek vajmi honfi érdemök vagyon szégyen elfelejtettétek túl fél századon nyelvünk kincsünk apáink örökségiből rabolt enyészet ellenünk esküdt idő nyelvünk veszendőben hozzája vég országútra kitaszítva halálos bajban feküvék kevély urak szent betegnek segélyt nyujtottatok hozzáléptetek egyet rugjatok költők valának ápolói rongyos éhes emberek ápolák menték lenézitek 
663,mélységes völgyben mélyben amik állnak közelében mozdulatlan gránitbércek vasnál vasabb falak lenéznek szédülni látszanak mély völgynek legmélyebb fenekén napvilág fél feketén jut bujkálás hold fonóleány kisérteties szálakat ereszt éjenként ezüst guzsalyán fonna szemfedőt magának völgyben szomorfűzfának tövén nyílt kicsiny virág homály lombok takarák körűle fény fagyott harmat reszketett örökkévaló könny levelén gyémánt vérző seb virág piros csoda összetépett szívből támada kevés vándor fordult tájon kevés szem akadott virágon látta hamarjában mehetett állt csodálkozó szemekkel bű növény nézte nézte érzett kínokat miktől lélek szerteszét szakad ölte láta szivott bódítón édes illatot barátom fájdalom virága virág lantod zenéje tiprád virágot hallgatott kezedben lant fájt fájt földhöz vágtad mintegy zokogva húrja kettépattant kiáltott rád lelk'ismeret rátetted gyilkos kezedet gyikos megölted testedet ennél többet jobb részedet lant lelke költőnek hah lelkedet öléd költő lelket semmisítni ismeréd küldetésedet szent föld pusztulóban haldoklófélben használ eső napsugár költő könnyhullatásitul mosolygásától fölvirul felelsz egykoron küldött számadásra von mondja nézz lefelé tetted útadat látszik hosszu sivatag rád bizott földet míveléd barátom drága perc föld futócsillagjai élünk leszaladunk bíró lehetsz barátom illeszd össze lantod leheld búbánatodat hisz költő legfájóbb hangot sohajtja legboldogabb dalold szived teli hang ajkadon kijő lelked darabja légyen dicső kín gyönyör elvérzeni 
666,durva ágyon végvonaglásomban szánakozó könnyeket lelek dicsőség lángész illatja árasztja fájdalom helyet énekelt ő imádkozott halt reményeinek özvegye ismétlem számlálva szenvedésim szegény gilbert szenvede bátorság költő beszéltek gondunk leszen lantodra reád tennap mondák vészben irgalom nyitá ajtaját reszkess gonoszság végdalom megpendül meghalok rajtad bélyege ah kiesik írótoll kezembül szegény gilbert szenvede hosszú sóhajtásaim után vigasztaló szó hangzanék baráti kéz megmelegítné reszkető kezem barátok hallják keservem estéjök lakomában foly veszik észre társok távollétét szegény gilbert szenvede megátkozám születésem napját természet gyönyörű este erdők illatával lebeg szellő ablakom sétálni párosan virágos fűben bent fák merengve űlni boldogság élet szegény gilbert szenvede 
669,kedvesem lágy kebele szíved buját érezem kicsiny madár dalolj tündéri dal hű szerelem ezüst arany bús vigyétek illat virág végtelen kert világ bús puszta ég hullatja diszét csillagok lehullanak fejem koszorunak hah lánc csörög hisz eltörék csörög kezeken földön csörög leestiben csatán zászlót lobogtatám hoztam haza vérző sebet elmúlt harc beforrt seb aludj aludj kedvesem szabadság szerelem 
690,föltámadott tenger népek tengere ijesztve eget földet szilaj hullámokat vet rémítő ereje látjátok táncot halljátok zenét tudtátok megtanulhatjátok mulat nép reng üvölt tenger hánykódnak hajók sűlyednek pokolra árboc vitorla megtörve tépve lóg tombold özönvíz tombold magadat mutasd mélységes medred dobáld fellegekre bőszült tajtékodat jegyezd vele égre örök tanúságúl habár fölűl gálya alúl víznek árja víz úr 
737,lassaban haragos lelkek testvére vihar lombjaim árnyékát zilálja dühöd szentegyház fészek oltár oltárnak papja csalogány dícsérje bántsd éneklésével istent természetet szent közös édesanyát 
751,alszik költő kezében apollónak lantja zenge szépen dala omlott vad folyam árja elhalt távoli patak módjára aludj néma költő észrevétlenül vihar szellő holt homlokod vihar harsog harcdalod harsogott szellő elhal szerelmi dalod 
764,indulsz pályavégezett év menj várj menj magad sötét másvilágba' égő lámpa vidd magaddal dalomat megpendítem régi lantom megpendítem húrjaid régóta nálam szóltál megpróbálom tudnál szépen szóltál éneked méltó neved hiréhez tedd ünnepibbekké ünnepélyes perceket tudja utósó legutósó dal leteszlek vehetlek hangod életed kihal hadistenhez szegődtem népéhez megyek esztendőre hallgat dal írok véres karddal írok költeményeket zengj zengj édes lantom zengd benned szólj vadúl szólj szelíden ragyogóan sötéten szomorúan vigan vihar haragában ősi tölgyeket szakít szellő mosolyogva csendes álomba ringatja mezők fűszálait tükör melyből néz életem legszebb virága mulandó ifjuság múlhatatlan szerelem adj hangot lantom benned maradt nap lemégyen pazarolva földön égen szétszór sugarat szólj erősen lantom utósó dalod hirtelen haljon ő zengjék időnek bércei századok 
777,1 fogadjatok dicső falak fogadj magadba híres ősi vár üdvezelve hős lakott költő lelkesedve hős lakott hunyadi lelkesűlés éget szivemnek hangos dobbanásai beszéljetek ajkaim lakott olykor épen gondolkodék bástya tetején tekintett jövőbe ő multba nézek pihené fáradalmait elzúgtak kemény csaták konstantinápoly tornyain büszke félholdat megingaták pihenő hely csendes magány lehajló völgynek zöld ölén vár éri vihar zászlót tornya tetején rejtezve világ elől szent magány lát messziről fehér fejével hegyek nagyapja vén retyezát 2 szólott hunyadvár bámuló gyönyörrel látok látok hunyadit megjöttél hősök hőse vártalak négy hosszu századig hittem fogsz jőni hitem erőt adott dőljek viselni bírjam négyszáz éves gyászt bánatot megjövél hévvel üdvezelve hosszan várt vendég hős apám fáj tud sírni kő örömkönyűimet ontanám felelt vendég sajnállak szegény vár örömedet rontani csalatkozol jött vártál nevem bem hunyadi szólt vár azzal törődjem mostan neved név mulandó változékony örök nézem szellemet nevedről szellemedrül müvéről ismerek reád voltál négyszáz év mentetted magyar hazát 
